{
  "$schema": "https://json-schema.org/draft/2020-12/schema",
  "$id": "https://goal-teams.local/schemas/v2.47/incremental-document.schema.json",
  "title": "Goal Teams V2.47 Incremental Document Manifest",
  "type": "object",
  "additionalProperties": false,
  "required": [
    "schema_version",
    "product_version",
    "schema",
    "validator",
    "operations",
    "ordering",
    "stable_prefix_encoding",
    "runtime_integration_state",
    "p0_projection_fixture"
  ],
  "properties": {
    "schema_version": {"const": "goal-teams-incremental-document-v2.47"},
    "product_version": {"const": "V2.47"},
    "schema": {"const": "schemas/v2.47/incremental-document.schema.json"},
    "validator": {"const": "scripts/checks/validate-v247-incremental-document.py"},
    "operations": {"const": ["append", "replace_section", "tombstone"]},
    "ordering": {"const": ["base_revision", "new_revision", "fragment_id"]},
    "stable_prefix_encoding": {"const": "canonical-json-utf8"},
    "runtime_integration_state": {"const": "contract_p0_not_runtime_integrated"},
    "p0_projection_fixture": {
      "type": "object",
      "additionalProperties": false,
      "required": [
        "document_id",
        "stable_prefix",
        "stable_prefix_sha256",
        "dynamic_tail_a",
        "dynamic_tail_b",
        "fragments",
        "expected_projection",
        "expected_projection_sha256",
        "expected_revision"
      ],
      "properties": {
        "document_id": {"type": "string", "minLength": 1},
        "stable_prefix": {"type": "array", "minItems": 1, "items": {"type": "string"}},
        "stable_prefix_sha256": {"type": "string", "pattern": "^[0-9a-f]{64}$"},
        "dynamic_tail_a": {"type": "array", "items": {"type": "string"}},
        "dynamic_tail_b": {"type": "array", "items": {"type": "string"}},
        "fragments": {
          "type": "array",
          "minItems": 1,
          "items": {"$ref": "#/$defs/fragment"}
        },
        "expected_projection": {"type": "string"},
        "expected_projection_sha256": {"type": "string", "pattern": "^[0-9a-f]{64}$"},
        "expected_revision": {"type": "integer", "minimum": 1}
      }
    }
  },
  "$defs": {
    "fragment": {
      "type": "object",
      "additionalProperties": false,
      "required": [
        "document_id",
        "fragment_id",
        "base_revision",
        "new_revision",
        "section_id",
        "operation",
        "content_ref",
        "content",
        "content_sha256",
        "actor_run_id",
        "created_at"
      ],
      "properties": {
        "document_id": {"type": "string", "minLength": 1},
        "fragment_id": {"type": "string", "minLength": 1},
        "base_revision": {"type": "integer", "minimum": 0},
        "new_revision": {"type": "integer", "minimum": 1},
        "section_id": {"type": "string", "minLength": 1},
        "operation": {"enum": ["append", "replace_section", "tombstone"]},
        "content_ref": {"type": "string", "minLength": 1},
        "content": {"type": "string"},
        "content_sha256": {"type": "string", "pattern": "^[0-9a-f]{64}$"},
        "actor_run_id": {"type": "string", "minLength": 1},
        "created_at": {
          "type": "string",
          "format": "date-time",
          "pattern": "^\\d{4}-\\d{2}-\\d{2}T\\d{2}:\\d{2}:\\d{2}(?:\\.\\d+)?(?:Z|[+-]\\d{2}:\\d{2})$"
        }
      }
    }
  }
}
